{
  "$schema": "https://json-schema.org/draft/2020-12/schema",
  "$id": "https://cumpleia.local/schemas/benchmark/run-config.schema.json",
  "title": "CumpleIA Benchmark Run Configuration",
  "type": "object",
  "additionalProperties": false,
  "required": [
    "schemaVersion",
    "runId",
    "candidateName",
    "baselineCommit",
    "taskFile",
    "transportConfig",
    "timeoutSeconds",
    "verificationProfile"
  ],
  "properties": {
    "schemaVersion": {
      "type": "string",
      "const": "1.0"
    },
    "runId": {
      "type": "string",
      "minLength": 1,
      "maxLength": 128,
      "pattern": "^[A-Za-z0-9][A-Za-z0-9._-]*$"
    },
    "candidateName": {
      "type": "string",
      "minLength": 1,
      "maxLength": 128,
      "pattern": "^[A-Za-z0-9][A-Za-z0-9._-]*$"
    },
    "baselineCommit": {
      "type": "string",
      "pattern": "^[0-9a-f]{40}$"
    },
    "taskFile": {
      "type": "string",
      "minLength": 1
    },
    "transportConfig": {
      "type": "string",
      "minLength": 1
    },
    "timeoutSeconds": {
      "type": "integer",
      "minimum": 1,
      "maximum": 86400
    },
    "verificationProfile": {
      "type": "string",
      "minLength": 1,
      "maxLength": 128,
      "pattern": "^[A-Za-z0-9][A-Za-z0-9._-]*$"
    }
  }
}
