{
  "schemaVersion": "1.0",
  "runId": "rat-active-organization-selector-v2-ornith-1.5-9b-q5km-local",
  "candidateName": "ornith-1.5-9b-q5km-local",
  "baselineCommit": "c29ac90b7486a8ab02af282b6c0978eaccd5809c",
  "taskFile": "docs/benchmark/runner/tasks/active-organization-selector-v1.md",
  "transportConfig": "docs/benchmark/runner/rounds/rat-active-organization-selector-v2/transport-ornith-1.5-9b-q5km-local.json",
  "timeoutSeconds": 1800,
  "verificationProfile": "rat-active-organization-selector-v2"
}
