{"schemaVersion":"1.0","runId":"rat-active-organization-selector-v1-qwen3-4b-local","candidateName":"qwen3-4b-local","baselineCommit":"c71c6fb666c9d3a3fbbf1a4a8b113c46c598f835","taskFile":"docs/benchmark/runner/tasks/active-organization-selector-v1.md","transportConfig":"docs/benchmark/runner/rounds/rat-organization-current-v1/transport-qwen3-4b-local.json","timeoutSeconds":1800,"verificationProfile":"rat-active-organization-selector-v1"}
