{"schemaVersion":"1.0","runId":"rat-active-organization-selector-v2-claude-sonnet-5","candidateName":"claude-sonnet-5","baselineCommit":"c29ac90b7486a8ab02af282b6c0978eaccd5809c","taskFile":"docs/benchmark/runner/tasks/active-organization-selector-v1.md","transportConfig":"docs/benchmark/runner/rounds/rat-organization-current-v1/transport-claude-sonnet-5.json","timeoutSeconds":1800,"verificationProfile":"rat-active-organization-selector-v2"}
