{
  "schemaVersion": "1.0",
  "runId": "rat-organization-current-v1-qwen3-4b-local-r3",
  "candidateName": "qwen3-4b-local",
  "baselineCommit": "4b3b4b74d71a312096b9329c6e80f5a31c40f03d",
  "taskFile": "docs/benchmark/runner/tasks/organization-current-v1.md",
  "transportConfig": "docs/benchmark/runner/rounds/rat-organization-current-v1/transport-qwen3-4b-local.json",
  "timeoutSeconds": 1800,
  "verificationProfile": "rat-organization-current-v1"
}
